,usageclass,checkouttype,materialtype,checkoutyear,checkoutmonth,checkouts,title,creator,subjects,publisher,publicationyear
3557,Digital,OverDrive,AUDIOBOOK,2018,1,10,"Duke of Desire: Maiden Lane Series, Book 12 (unabridged) (Unabridged)",Elizabeth Hoyt,"Fiction, Historical Fiction, Romance","Blackstone Audio, Inc.",2017
3573,Digital,OverDrive,AUDIOBOOK,2018,1,1,"Highlander Untamed: MacLeods of Skye Series, Book 1 (unabridged) (Unabridged)",Monica McCarty,"Fiction, Literature","Tantor Media, Inc",2015
3577,Digital,OverDrive,AUDIOBOOK,2018,1,2,The Culture Code: The Secrets of Highly Successful Groups (unabridged) (Unabridged),Daniel Coyle,"Business, Nonfiction, Psychology, Self-Improvement",Books on Tape,2018
3588,Digital,OverDrive,AUDIOBOOK,2018,1,5,"First Test: Protector of the Small Series, Book 1 (unabridged) (Unabridged)",Tamora Pierce,"Fantasy, Young Adult Fiction",Books on Tape,2007
3592,Digital,OverDrive,AUDIOBOOK,2018,1,11,"The Two Towers: The Lord of the Rings Series, Book 2 (unabridged selections) (Unabridged Selections)",J. R. R. Tolkien,"Fantasy, Fiction",HighBridge Company,2007
3599,Digital,OverDrive,AUDIOBOOK,2018,1,2,"Trapped: The Iron Druid Chronicles, Book 5 (unabridged) (Unabridged)",Kevin Hearne,"Fantasy, Fiction, Thriller",Books on Tape,2012
3672,Digital,OverDrive,AUDIOBOOK,2018,1,1,"Dead to Rights: Joanna Brady Mystery Series, Book 4 (unabridged) (Unabridged)",J. A. Jance,"Fiction, Mystery",Books In Motion,2005
3683,Digital,OverDrive,AUDIOBOOK,2018,1,1,Mindsharing: The Art of Crowdsourcing Everything (unabridged) (Unabridged),Lior Zoref,"Nonfiction, Self-Improvement",Gildan Media Corp,2015
3704,Digital,OverDrive,AUDIOBOOK,2018,1,1,An Italian Wife (Unabridged),Ann Hood,"Fiction, Literature","Blackstone Audio, Inc.",2014
3711,Digital,OverDrive,AUDIOBOOK,2018,1,2,Wonderfully Made (Unabridged),Joyce Meyer,"Juvenile Fiction, Picture Book Fiction",Zondervan,2013
3714,Digital,OverDrive,AUDIOBOOK,2018,1,4,The Weight of Night: A Novel of Suspense (unabridged) (Unabridged),Christine Carbo,"Fiction, Mystery, Thriller","Blackstone Audio, Inc.",2017
3719,Digital,OverDrive,AUDIOBOOK,2018,1,3,"Sleeping Dogs: Butcher's Boy Series, Book 2 (unabridged) (Unabridged)",Thomas Perry,"Fiction, Mystery","Tantor Media, Inc",2012
3722,Digital,OverDrive,AUDIOBOOK,2018,1,1,Soundless (Unabridged),Richelle Mead,"Fantasy, Romance, Young Adult Fiction",Books on Tape,2015
3723,Digital,OverDrive,AUDIOBOOK,2018,1,1,Marco Polo: From Venice to Xanadu (unabridged) (Unabridged),Laurence Bergreen,"Biography & Autobiography, Nonfiction",Books on Tape,2007
3740,Digital,OverDrive,AUDIOBOOK,2018,1,2,JFK and the Unspeakable: Why He Died and Why It Matters (unabridged) (Unabridged),James W. Douglass,"Biography & Autobiography, History, Nonfiction, Politics","Tantor Media, Inc",2014
3743,Digital,OverDrive,AUDIOBOOK,2018,1,2,50 Ways to Soothe Yourself Without Food (Unabridged),Susan Albers,"Health & Fitness, Nonfiction","Tantor Media, Inc",2014
3747,Digital,OverDrive,AUDIOBOOK,2018,1,1,"Heck: Where the Bad Kids Go: The Circles of Heck Series, Book 1 (unabridged) (Unabridged)",Dale E. Basye,"Fantasy, Humor (Fiction), Juvenile Fiction","Blackstone Audio, Inc.",2010
3765,Digital,OverDrive,AUDIOBOOK,2018,1,1,"Dismissed With Prejudice: J. P. Beaumont Series, Book 7 (unabridged) (Unabridged)",J. A. Jance,"Fiction, Mystery",Books In Motion,2005
3798,Digital,OverDrive,AUDIOBOOK,2018,1,6,Supernormal: The Untold Story of Adversity and Resilience (unabridged) (Unabridged),"Meg Jay, PhD","Nonfiction, Psychology, Self-Improvement","Blackstone Audio, Inc.",2017
3814,Digital,OverDrive,AUDIOBOOK,2018,1,2,"Suck It, Wonder Woman!: The Misadventures of a Hollywood Geek (unabridged) (Unabridged)",Olivia Munn,"Biography & Autobiography, Humor (Nonfiction), Nonfiction, Performing Arts",Macmillan Audio,2014
3815,Digital,OverDrive,AUDIOBOOK,2018,1,1,22 Britannia Road: A Novel (unabridged) (Unabridged),Amanda Hodgkinson,"Fiction, Literature",Books on Tape,2011
3817,Digital,OverDrive,AUDIOBOOK,2018,1,1,FDR (Unabridged),Jean Edward Smith,"Biography & Autobiography, Nonfiction",Books on Tape,2007
3825,Digital,OverDrive,AUDIOBOOK,2018,1,1,"Work Song: Whistling Season Series, Book 2 (unabridged) (Unabridged)",Ivan Doig,"Fiction, Literature","Recorded Books, LLC",2016
3844,Digital,OverDrive,AUDIOBOOK,2018,1,2,What Dreams May Come (Unabridged),Richard Matheson,"Fantasy, Fiction","Blackstone Audio, Inc.",2012
3848,Digital,OverDrive,AUDIOBOOK,2018,1,1,"The Wyrm King: Beyond the Spiderwick Chronicles, Book 3 (unabridged) (Unabridged)",Holly Black,"Fantasy, Juvenile Fiction, Mythology",Simon & Schuster - All Library,2009
3876,Digital,OverDrive,AUDIOBOOK,2018,1,7,"Smart but Scattered: The Revolutionary ""Executive Skills"" Approach to Helping Kids Reach Their Potential (unabridged) (Unabridged)","Peg Dawson, Ed.D.","Family & Relationships, Nonfiction","Tantor Media, Inc",2012
3890,Digital,OverDrive,AUDIOBOOK,2018,1,1,"Where the Wind Leads: A Refugee Family's Miraculous Story of Loss, Rescue, and Redemption (unabridged) (Unabridged)",Dr. Vinh Chung,"Nonfiction, Religion & Spirituality",Thomas Nelson Inc.,2014
3901,Digital,OverDrive,AUDIOBOOK,2018,1,1,Second Chance Summer (Unabridged),Jill Shalvis,"Fiction, Romance","Blackstone Audio, Inc.",2015
3903,Digital,OverDrive,AUDIOBOOK,2018,1,9,"The Mystery of the Blue Train: Hercule Poirot Series, Book 6 (unabridged) (Unabridged)",Agatha Christie,"Fiction, Mystery",HarperCollins Publishers Inc.,2017
3906,Digital,OverDrive,AUDIOBOOK,2018,1,2,The End of Everything: A Novel (unabridged) (Unabridged),Megan Abbott,"Fiction, Mystery, Thriller","Blackstone Audio, Inc.",2011
3908,Digital,OverDrive,AUDIOBOOK,2018,1,4,Oliver Loving: A Novel (unabridged) (Unabridged),Stefan Merrill Block,"Fiction, Literature",Macmillan Audio,2018
3915,Digital,OverDrive,AUDIOBOOK,2018,1,3,Light in August (Unabridged),William Faulkner,"Fiction, Literature",Books on Tape,2006
3923,Digital,OverDrive,AUDIOBOOK,2018,1,6,The Age of Cryptocurrency: How Bitcoin and Digital Money Are Challenging the Global Economic Order (unabridged) (Unabridged),Paul Vigna,"Business, Nonfiction",Gildan Media Corp,2015
3944,Digital,OverDrive,AUDIOBOOK,2018,1,2,Landmark: The Inside Story of America's New Health Care Law and What It Means for Us All (unabridged) (Unabridged),The Staff of the Washington Post,"Current Events, Health & Fitness, Nonfiction","Blackstone Audio, Inc.",2010
3945,Digital,OverDrive,AUDIOBOOK,2018,1,19,American War: A Novel (unabridged) (Unabridged),Omar El Akkad,"Fantasy, Fiction, Literature",Books on Tape,2017
3946,Digital,OverDrive,AUDIOBOOK,2018,1,1,"Poppet: Jack Caffery Series, Book 6 (unabridged) (Unabridged)",Mo Hayder,"Fiction, Mystery, Suspense, Thriller","Dreamscape Media, LLC",2013
3955,Digital,OverDrive,AUDIOBOOK,2018,1,1,Spanish on the Move for Kids: Lively Songs and Games for Busy Kids (unabridged) (Unabridged),Catherine Bruzzone,"Foreign Language Study, Foreign Language Study - Spanish, Juvenile Nonfiction",McGraw-Hill Professional,2005
3961,Digital,OverDrive,AUDIOBOOK,2018,1,2,Frost Line (Unabridged),Linda Howard,"Fantasy, Fiction, Romance, Suspense",HarperCollins Publishers Inc.,2016
3965,Digital,OverDrive,AUDIOBOOK,2018,1,1,"Island in the Sea of Time: Emberverse: Island in the Sea of Time Series, Book 1 (unabridged) (Unabridged)",S. M. Stirling,"Fiction, Historical Fiction, Science Fiction","Tantor Media, Inc",2009
3973,Digital,OverDrive,AUDIOBOOK,2018,1,1,"The Amazing Mexican Secret: Flat Stanley's Worldwide Adventures Series, Book 5 (unabridged) (Unabridged)",Jeff Brown,"Humor (Fiction), Juvenile Fiction",HarperCollins Publishers Inc.,2014
3979,Digital,OverDrive,AUDIOBOOK,2018,1,1,Lum: A Novel (unabridged) (Unabridged),Libby Ware,"Fiction, Historical Fiction","Big Happy Family, LLC",2016
3990,Digital,OverDrive,AUDIOBOOK,2018,1,1,The Empty Land (Unabridged),Louis L'Amour,"Fiction, Western",Books on Tape,2013
3992,Digital,OverDrive,AUDIOBOOK,2018,1,9,We Were the Lucky Ones (Unabridged),Georgia Hunter,"Fiction, Historical Fiction, Literature",Books on Tape,2017
4026,Digital,OverDrive,AUDIOBOOK,2018,1,3,Orthodoxy (Unabridged),G. K. Chesterton,"Nonfiction, Religion & Spirituality","Blackstone Audio, Inc.",2009
4032,Digital,OverDrive,AUDIOBOOK,2018,1,5,"Children of Dune: Dune Series, Book 3 (unabridged) (Unabridged)",Frank Herbert,"Fiction, Science Fiction",Macmillan Audio,2013
4034,Digital,OverDrive,AUDIOBOOK,2018,1,2,"Runemarks: Runemarks Series, Book 1 (unabridged) (Unabridged)",Joanne Harris,"Mythology, Young Adult Fiction",Books on Tape,2008
4044,Digital,OverDrive,AUDIOBOOK,2018,1,1,The Heavenly Table: A Novel (unabridged) (Unabridged),Donald Ray Pollock,"Fiction, Literature, Suspense, Thriller",Books on Tape,2016
4045,Digital,OverDrive,AUDIOBOOK,2018,1,3,Her Fearful Symmetry (Unabridged),Audrey Niffenegger,"Fiction, Horror","Recorded Books, LLC",2017
4047,Digital,OverDrive,AUDIOBOOK,2018,1,2,The Sum of All Kisses (Unabridged),Julia Quinn,"Fiction, Historical Fiction, Romance",HarperCollins Publishers Inc.,2013
4050,Digital,OverDrive,AUDIOBOOK,2018,1,4,"Callander Square: Thomas Pitt Series, Book 2 (unabridged) (Unabridged)",Anne Perry,"Fiction, Mystery","Recorded Books, LLC",2017
4076,Digital,OverDrive,AUDIOBOOK,2018,1,2,The Velveteen Rabbit (Unabridged),Meryl Streep,"Juvenile Fiction, Juvenile Literature",Books on Tape,2007
4091,Digital,OverDrive,AUDIOBOOK,2018,1,2,Secretly Smitten (Unabridged),Colleen Coble,"Christian Fiction, Fiction, Romance","Oasis Audio, LLC",2013
4093,Digital,OverDrive,AUDIOBOOK,2018,1,2,Maximize Your Potential Through The Power Of Your Subconscious Mind For An Enriched Life (Unabridged),Dr. Joseph Murphy,"Nonfiction, Self-Improvement",Gildan Media Corp,2012
4096,Digital,OverDrive,AUDIOBOOK,2018,1,10,"Behind the Beautiful Forevers: Life, death, and hope in a Mumbai undercity (unabridged) (Unabridged)",Katherine Boo,"History, Nonfiction, Sociology",Books on Tape,2012
4106,Digital,OverDrive,AUDIOBOOK,2018,1,1,"Murder on the Home Front: A True Story of Morgues, Murderers, and Mysteries During the London Blitz (unabridged) (Unabridged)",Molly Lefebure,"Biography & Autobiography, Nonfiction","Blackstone Audio, Inc.",2014
4107,Digital,OverDrive,AUDIOBOOK,2018,1,1,Daniel Deronda (Unabridged),George Eliot,"Drama, Fiction",Random House Group Limited,2009
4111,Digital,OverDrive,AUDIOBOOK,2018,1,1,Flappers and Philosophers (Unabridged),F. Scott Fitzgerald,"Classic Literature, Fiction","Blackstone Audio, Inc.",2008
4138,Digital,OverDrive,AUDIOBOOK,2018,1,1,"Eternal: Shadow Falls: After Dark Series, Book 2 (unabridged) (Unabridged)",C. C. Hunter,"Fantasy, Romance, Thriller, Young Adult Fiction",Macmillan Audio,2014
4156,Digital,OverDrive,AUDIOBOOK,2018,1,1,The Beggar King and the Secret of Happiness: A True Story (unabridged) (Unabridged),Joel ben Izzy,"Biography & Autobiography, Nonfiction, Self-Improvement",HighBridge Company,2013
4165,Digital,OverDrive,AUDIOBOOK,2018,1,2,"The Winter Queen: Erast Fandorin Series, Book 1 (unabridged) (Unabridged)",Boris Akunin,"Fiction, Historical Fiction, Mystery, Suspense",Books on Tape,2013
4166,Digital,OverDrive,AUDIOBOOK,2018,1,1,Where Did You Sleep Last Night?: A Personal History (unabridged) (Unabridged),Danzy Senna,"Biography & Autobiography, Nonfiction","Blackstone Audio, Inc.",2009
4173,Digital,OverDrive,AUDIOBOOK,2018,1,2,Che Guevara: A Revolutionary Life (unabridged) (Unabridged),Jon Lee Anderson,"Biography & Autobiography, Nonfiction","Blackstone Audio, Inc.",2009
4174,Digital,OverDrive,AUDIOBOOK,2018,1,6,The Robber Bride (Unabridged),Margaret Atwood,"Fiction, Literature",Books on Tape,2011
4181,Digital,OverDrive,AUDIOBOOK,2018,1,6,The Saboteur: A Novel (unabridged) (Unabridged),Andrew Gross,"Fiction, Historical Fiction, Literature, Thriller",Macmillan Audio,2017
4184,Digital,OverDrive,AUDIOBOOK,2018,1,5,"Takedown Twenty: Stephanie Plum Series, Book 20 (unabridged) (Unabridged)",Janet Evanovich,"Fiction, Humor (Fiction), Mystery",Books on Tape,2013
4190,Digital,OverDrive,AUDIOBOOK,2018,1,4,Needful Things (Unabridged),Stephen King,"Fiction, Horror",HighBridge Company,2008
4206,Digital,OverDrive,AUDIOBOOK,2018,1,2,True to the Game I (Unabridged),Teri Woods,"African American Fiction, Fiction, Thriller, Urban Fiction","Blackstone Audio, Inc.",2012
4212,Digital,OverDrive,AUDIOBOOK,2018,1,8,The Birdwatcher (Unabridged),William Shaw,"Fiction, Mystery",Hachette Audio,2017
4214,Digital,OverDrive,AUDIOBOOK,2018,1,1,Veil of Night: A Novel (unabridged) (Unabridged),Linda Howard,"Fiction, Romance, Suspense",Books on Tape,2010
4219,Digital,OverDrive,AUDIOBOOK,2018,1,2,"Lover Unbound: Black Dagger Brotherhood Series, Book 5 (unabridged) (Unabridged)",J. R. Ward,"Fantasy, Fiction, Romance","Recorded Books, LLC",2016
4227,Digital,OverDrive,AUDIOBOOK,2018,1,1,What This Story Needs Is a Pig in a Wig (Unabridged),Emma J. Virjan,"Beginning Reader, Humor (Fiction), Juvenile Fiction",HarperCollins Publishers Inc.,2015
4229,Digital,OverDrive,AUDIOBOOK,2018,1,1,Sunday Kind of Love (Unabridged),Dorothy Garlock,"Fiction, Historical Fiction, Romance","Blackstone Audio, Inc.",2016
4239,Digital,OverDrive,AUDIOBOOK,2018,1,2,"Secrets of an Accidental Duchess: Donovan Series, Book 2 (unabridged) (Unabridged)",Jennifer Haymore,"Fiction, Romance","Tantor Media, Inc",2012
4249,Digital,OverDrive,AUDIOBOOK,2018,1,2,Protection Workshop (Unabridged),Cassandra Eason,"Nonfiction, Religion & Spirituality, Self Help, Self-Improvement","Blackstone Audio, Inc.",2013
4267,Digital,OverDrive,AUDIOBOOK,2018,1,5,The Arrangements (Unabridged),Chimamanda Ngozi Adichie,"Fiction, Literature",Books on Tape,2016
4268,Digital,OverDrive,AUDIOBOOK,2018,1,1,Pax Britannica: The Climax of Empire (Unabridged),Jan Morris,"History, Nonfiction","Naxos of America, Inc.",2012
4307,Digital,OverDrive,AUDIOBOOK,2018,1,1,Why People Don't Heal: And How They Can (unabridged) (Unabridged),Caroline Myss,"Health & Fitness, Nonfiction","Sounds True, Inc",2013
4315,Digital,OverDrive,AUDIOBOOK,2018,1,2,The Story of English in 100 Words (Unabridged),David Crystal,"Language Arts, Nonfiction","Blackstone Audio, Inc.",2012
4355,Digital,OverDrive,AUDIOBOOK,2018,1,2,"Freak the Mighty: Max the Mighty Series, Book 1 (unabridged) (Unabridged)",Rodman Philbrick,"Juvenile Fiction, Juvenile Literature",Books on Tape,2011
4358,Digital,OverDrive,AUDIOBOOK,2018,1,1,Bone by Bone (Unabridged),Carol O'Connell,"Fiction, Mystery, Thriller","Listen & Live Audio, Inc.",2012
4363,Digital,OverDrive,AUDIOBOOK,2018,1,2,Gai-Jin (Unabridged),James Clavell,"Fiction, Literature",Books on Tape,2007
4373,Digital,OverDrive,AUDIOBOOK,2018,1,2,I Am The Word: A Guide to the Consciousness of Man's Self in a Transitioning Time (unabridged) (Unabridged),Paul Selig,"Nonfiction, Self-Improvement",Gildan Media Corp,2014
4379,Digital,OverDrive,AUDIOBOOK,2018,1,5,Stuart Little (Unabridged),E. B. White,"Juvenile Fiction, Juvenile Literature",Books on Tape,2007
4383,Digital,OverDrive,AUDIOBOOK,2018,1,2,"Overture To Death: Roderick Alleyn Series, Book 8 (unabridged) (Unabridged)",Ngaio Marsh,"Fiction, Mystery, Suspense","Blackstone Audio, Inc.",2008
4395,Digital,OverDrive,AUDIOBOOK,2018,1,9,"Legend: Legend Series, Book 1 (unabridged) (Unabridged)",Marie Lu,"Science Fiction, Thriller, Young Adult Fiction",Books on Tape,2011
4415,Digital,OverDrive,AUDIOBOOK,2018,1,3,"The Three Lives of James Madison: Genius, Partisan, President (unabridged) (Unabridged)",Noah Feldman,"Biography & Autobiography, History, Law, Nonfiction",Books on Tape,2017
4420,Digital,OverDrive,AUDIOBOOK,2018,1,1,"The Terror of the Southlands: The Very Nearly Honorable League of Pirates Series, Book 2 (unabridged) (Unabridged)",Caroline Carlson,"Fantasy, Humor (Fiction), Juvenile Fiction",HarperCollins Publishers Inc.,2014
4424,Digital,OverDrive,AUDIOBOOK,2018,1,2,Meditations for Peace of Mind: Relax and Appreciate Your Uniqueness (unabridged) (Unabridged),"Bernie S. Siegel, M.D.","Nonfiction, Self-Improvement",Hay House,2007
4439,Digital,OverDrive,AUDIOBOOK,2018,1,7,The Hobbit (Abridged),J. R. R. Tolkien,"Fantasy, Juvenile Fiction",Random House Group Limited,2015
4456,Digital,OverDrive,AUDIOBOOK,2018,1,2,Will I Ever Be Free of You?: How to Navigate a High-Conflict Divorce from a Narcissist and Heal Your Family (unabridged) (Unabridged),"Karyl McBride, PhD","Family & Relationships, Nonfiction, Psychology","Blackstone Audio, Inc.",2015
4457,Digital,OverDrive,AUDIOBOOK,2018,1,5,"The Wine-Dark Sea: Aubrey / Maturin Series, Book 16 (unabridged) (Unabridged)",Patrick O'Brian,"Fiction, Historical Fiction","Blackstone Audio, Inc.",2008
4474,Digital,OverDrive,AUDIOBOOK,2018,1,1,"The Immortal Who Loved Me: The Argeneau Family Series, Book 21 (unabridged) (Unabridged)",Lynsay Sands,"Fantasy, Fiction, Romance",HarperCollins Publishers Inc.,2015
4481,Digital,OverDrive,AUDIOBOOK,2018,1,3,"Blackout: Newsflesh Series, Book 3 (unabridged) (Unabridged)",Mira Grant,"Fiction, Science Fiction",Hachette Audio,2017
4495,Digital,OverDrive,AUDIOBOOK,2018,1,2,"That Hideous Strength: Cosmic Trilogy, Book 3 (unabridged) (Unabridged)",C. S. Lewis,"Fantasy, Fiction, Science Fiction","Blackstone Audio, Inc.",2011
4499,Digital,OverDrive,AUDIOBOOK,2018,1,1,"Portrait of a Monster: Joran van der Sloot, a Murder in Peru, and the Natalee Holloway Mystery (unabridged) (Unabridged)",Lisa Pulitzer,"Nonfiction, True Crime","Dreamscape Media, LLC",2011
4508,Digital,OverDrive,AUDIOBOOK,2018,1,2,Who Killed These Girls?: Cold Case: The Yogurt Shop Murders (unabridged) (Unabridged),Beverly Lowry,"History, Nonfiction, Sociology, True Crime",Books on Tape,2016
4513,Digital,OverDrive,AUDIOBOOK,2018,1,8,"The Voyage of the Dawn Treader: The Chronicles of Narnia, Book 5 (unabridged) (Unabridged)",C. S. Lewis,"Fantasy, Juvenile Fiction",HarperCollins Publishers Inc.,2005
4520,Digital,OverDrive,AUDIOBOOK,2018,1,1,"The Riven Kingdom: Godspeaker Trilogy, Book 2 (unabridged) (Unabridged)",Karen Miller,"Fantasy, Fiction","Tantor Media, Inc",2013
4524,Digital,OverDrive,AUDIOBOOK,2018,1,1,Celebrate America,Twin Sisters Productions,"Juvenile Nonfiction, Music","Twin Sisters Productions, LLC",2005
4526,Digital,OverDrive,AUDIOBOOK,2018,1,14,Murder Games (Unabridged),James Patterson,"Fiction, Thriller","Blackstone Audio, Inc.",2017
4531,Digital,OverDrive,AUDIOBOOK,2018,1,3,"The Bughouse: The Poetry, Politics, and Madness of Ezra Pound (unabridged) (Unabridged)",Daniel Swift,"Biography & Autobiography, History, Nonfiction","Tantor Media, Inc",2018
4532,Digital,OverDrive,AUDIOBOOK,2018,1,1,"Hunted: House of Night Series, Book 5 (unabridged) (Unabridged)",P. C. Cast,"Fantasy, Young Adult Fiction, Young Adult Literature",Macmillan Audio,2009
4545,Digital,OverDrive,AUDIOBOOK,2018,1,1,VocabuLearn® Italian Complete (Unabridged),"Penton Overseas, Inc.","Foreign Language Study, Foreign Language Study - Italian, Nonfiction","Penton Overseas, Inc.",2006
4553,Digital,OverDrive,AUDIOBOOK,2018,1,1,"The Dukan Diet: 2 Steps to Lose the Weight, 2 Steps to Keep It Off Forever (unabridged) (Unabridged)",Pierre Dukan,"Health & Fitness, Nonfiction",Books on Tape,2011
4555,Digital,OverDrive,AUDIOBOOK,2018,1,3,"Ask the Cards a Question: Sharon McCone Mystery Series, Book 2 (unabridged) (Unabridged)",Marcia Muller,"Fiction, Mystery","Blackstone Audio, Inc.",2011
4558,Digital,OverDrive,AUDIOBOOK,2018,1,2,"The Queen of Katwe: Story of Life, Chess, and One Extraordinary Girl's Dream of Becoming a Grandmaster (unabridged) (Unabridged)",Tim Crothers,"Biography & Autobiography, Nonfiction","Recorded Books, LLC",2016
4559,Digital,OverDrive,AUDIOBOOK,2018,1,3,"Princess in Black Series, Books 1-3: The Princess in Black; The Princess in Black and the Perfect Princess Party; The Princess in Black and the Hungry Bunny Horde (unabridged) (Unabridged)",Shannon Hale,"Juvenile Fiction, Juvenile Literature",Books on Tape,2016
4565,Digital,OverDrive,AUDIOBOOK,2018,1,2,"The True Meaning of Smekday: Smek Series, Book 1 (unabridged) (Unabridged)",Adam Rex,"Humor (Fiction), Juvenile Fiction, Science Fiction",Books on Tape,2010
4583,Digital,OverDrive,AUDIOBOOK,2018,1,5,"A More Perfect Union: J. P. Beaumont Series, Book 6 (unabridged) (Unabridged)",J. A. Jance,"Fiction, Mystery",Books In Motion,2008
4589,Digital,OverDrive,AUDIOBOOK,2018,1,6,"Titan: The Life of John D. Rockefeller, Sr. (unabridged) (Unabridged)",Ron Chernow,"Biography & Autobiography, Business, History, Nonfiction","Blackstone Audio, Inc.",2013
4594,Digital,OverDrive,AUDIOBOOK,2018,1,2,The Time Machine (Unabridged),H. G. Wells,"Classic Literature, Fiction","Phoenix Books, Inc.",2008
4619,Digital,OverDrive,AUDIOBOOK,2018,1,2,"The Hanging in the Hotel: Fethering Mystery Series, Book 5 (unabridged) (Unabridged)",Simon Brett,"Fiction, Mystery","Blackstone Audio, Inc.",2008
4628,Digital,OverDrive,AUDIOBOOK,2018,1,8,The Little Book of Common Sense Investing: The Only Way to Guarantee Your Fair Share of Stock Market Returns (unabridged) (Unabridged),John C. Bogle,"Business, Nonfiction",Macmillan Audio,2008
4654,Digital,OverDrive,AUDIOBOOK,2018,1,1,Tales from the Tardis: Volume 2 (unabridged) (Unabridged),BBC Audiobooks,"Fiction, Science Fiction",Random House Group Limited,2010
4655,Digital,OverDrive,AUDIOBOOK,2018,1,7,Savage Country: A Novel (unabridged) (Unabridged),Robert Olmstead,"Fiction, Historical Fiction, Western",HighBridge Company,2017
4661,Digital,OverDrive,AUDIOBOOK,2018,1,1,The Tale of Peter Rabbit (Unabridged),Beatrix Potter,"Classic Literature, Fantasy, Juvenile Fiction",Interactive Media,2013
4681,Digital,OverDrive,AUDIOBOOK,2018,1,1,"At the Earth's Core: Pellucidar Series, Book 1 (unabridged) (Unabridged)",Edgar Rice Burroughs,"Classic Literature, Fantasy, Fiction, Science Fiction","Tantor Media, Inc",2009
4705,Digital,OverDrive,AUDIOBOOK,2018,1,6,"Dark Saturday: Frieda Klein Series, Book 6 (unabridged) (Unabridged)",Nicci French,"Fiction, Mystery, Thriller",HarperCollins Publishers Inc.,2017
4709,Digital,OverDrive,AUDIOBOOK,2018,1,1,The Railwayman's Wife: A Novel (unabridged) (Unabridged),Ashley Hay,"Fiction, Historical Fiction, Literature",Simon & Schuster - All Library,2016
4710,Digital,OverDrive,AUDIOBOOK,2018,1,14,"Haunted: Michael Bennett Series, Book 10 (unabridged) (Unabridged)",James Patterson,"Fiction, Thriller","Blackstone Audio, Inc.",2017
4713,Digital,OverDrive,AUDIOBOOK,2018,1,24,Rules of Civility: A Novel (unabridged) (Unabridged),Amor Towles,"Fiction, Literature",Books on Tape,2017
4718,Digital,OverDrive,AUDIOBOOK,2018,1,4,"Terminal Freeze: Jeremy Logan Series, Book 2 (unabridged) (Unabridged)",Lincoln Child,"Fiction, Thriller",Books on Tape,2009
4721,Digital,OverDrive,AUDIOBOOK,2018,1,2,The Pope of Palm Beach: A Novel (unabridged) (Unabridged),Tim Dorsey,"Fiction, Humor (Fiction), Literature, Mystery",HarperCollins Publishers Inc.,2018
4723,Digital,OverDrive,AUDIOBOOK,2018,1,1,"Buffalo Before Breakfast: Magic Tree House Series, Book 18 (unabridged) (Unabridged)",Mary Pope Osborne,"Historical Fiction, Juvenile Fiction",Books on Tape,2017
4738,Digital,OverDrive,AUDIOBOOK,2018,1,3,Three Junes: A Novel (unabridged) (Unabridged),Julia Glass,"Fiction, Literature",Books on Tape,2007
4746,Digital,OverDrive,AUDIOBOOK,2018,1,2,Hybrids (Unabridged),Whitley Strieber,"Fiction, Literature, Science Fiction","Tantor Media, Inc",2014
4752,Digital,OverDrive,AUDIOBOOK,2018,1,1,Fun Is Good: How to Create Joy & Passion in your Workplace & Career (unabridged) (Unabridged),Mike Veeck,"Business, Management, Nonfiction, Self-Improvement",Gildan Media Corp,2013
4753,Digital,OverDrive,AUDIOBOOK,2018,1,4,"The Gamble: Colorado Mountain Series, Book 1 (unabridged) (Unabridged)",Kristen Ashley,"Fiction, Romance","Blackstone Audio, Inc.",2014
4764,Digital,OverDrive,AUDIOBOOK,2018,1,1,Aprenda en su Auto Inglés Completo (Unabridged),Henry N. Raymond,"Foreign Language Study, Nonfiction","Penton Overseas, Inc.",2009
4811,Digital,OverDrive,AUDIOBOOK,2018,1,1,"Showtime: Magic, Kareem, Riley, and the Los Angeles Lakers Dynasty of the 1980s (unabridged) (Unabridged)",Jeff Pearlman,"Nonfiction, Sports & Recreations","Blackstone Audio, Inc.",2014
4814,Digital,OverDrive,AUDIOBOOK,2018,1,3,"The Burning Bridge: Ranger's Apprentice Series, Book 2 (unabridged) (Unabridged)",John A. Flanagan,"Juvenile Fiction, Juvenile Literature, Mythology",Books on Tape,2017
4820,Digital,OverDrive,AUDIOBOOK,2018,1,2,"Skeleton Hill: Peter Diamond Mystery Series, Book 10 (unabridged) (Unabridged)",Peter Lovesey,"Fiction, Thriller","Blackstone Audio, Inc.",2011
4835,Digital,OverDrive,AUDIOBOOK,2018,1,62,"Where'd You Go, Bernadette: A Novel (unabridged) (Unabridged)",Maria Semple,"Fiction, Literature","Blackstone Audio, Inc.",2012
4836,Digital,OverDrive,AUDIOBOOK,2018,1,4,"My Age of Anxiety: Fear, Hope, Dread, and the Search for Peace of Mind (unabridged) (Unabridged)",Scott Stossel,"Biography & Autobiography, Medical, Nonfiction, Psychology",Books on Tape,2014
4838,Digital,OverDrive,AUDIOBOOK,2018,1,2,"The World Broke in Two: Virginia Woolf, T. S. Eliot, D. H. Lawrence, E. M. Forster and the Year That Changed Literature (unabridged) (Unabridged)",Bill Goldstein,"Biography & Autobiography, Literary Criticism, Nonfiction",Macmillan Audio,2017
4849,Digital,OverDrive,AUDIOBOOK,2018,1,2,Communist Manifesto and Social Contract (Unabridged),Ralph Raico,"Nonfiction, Philosophy","Blackstone Audio, Inc.",2008
4854,Digital,OverDrive,AUDIOBOOK,2018,1,4,The Glass Cell (Unabridged),Patricia Highsmith,"Fiction, Literature, Mystery","Blackstone Audio, Inc.",2017
4867,Digital,OverDrive,AUDIOBOOK,2018,1,4,The Shallows: What the Internet Is Doing to Our Brains (unabridged) (Unabridged),Nicholas Carr,"Current Events, Nonfiction","Blackstone Audio, Inc.",2010
4875,Digital,OverDrive,AUDIOBOOK,2018,1,1,"Foolish Games: Out of Bounds Series, Book 2 (unabridged) (Unabridged)",Tracy Solheim,"Erotic Literature, Fiction, Romance","Tantor Media, Inc",2015
